requirements,requirement_type
"Each engine and auxiliary power unit mount and its supporting structure must be designed for a limit load factor in lateral direction, for the side load on the engine and auxiliary power unit mount, at least equal to the maximum load factor obtained in the yawing conditions but not less than 1. 33.","0"
"Each cockpit voice recorder shall record voice or audio signals identifying navigation or approach aids introduced into a headset or speaker.","1"
"Each fuel storage system must be isolated from personnel compartments and protected from hazards due to unintended temperature influences.","0"
"The pilot compartment, its equipment, and its arrangement to include pilot view, must allow each pilot to perform his or her duties, including taxi, takeoff, climb, cruise, descent, approach, landing, and perform any maneuvers within the operating envelope of the airplane, without excessive concentration, skill, alertness, or fatigue.","1"
"There must be a clearance of at least 18 inches between each propeller and the water, unless compliance with Section 25 - 239 ( a ) can be shown with a lesser clearance.","0"
"For each part that requires maintenance, preventive maintenance, or servicing, a means into the aircraft design must be incorporated to allow such actions to be accomplished.","1"
"The airplane must be designed to withstand any vibration and buffeting that might occur in any likely operating condition up to V _ D / M _ D, including stall and probable inadvertent excursions beyond the boundaries of the buffet onset envelope.","0"
"Each component, line, fitting, and control subject to fire conditions must be fireproof if storing concentrated flammable fluids.","1"
"The means used to limit the low pitch position of the propeller blades must be set so that the engine does not exceed 103 percent of the maximum allowable engine rpm or 99 percent of an approved maximum overspeed, whichever is greater, with the propeller blades at the low pitch limit and governor inoperative.","0"
"Any position and anti - collision lights must have the colors to provide sufficient time for another aircraft to avoid a collision.","0"
"Any position lights must include a green light on the right side of the airplane.","0"
"Indication systems that integrate the display of flight or powerplant parameters to operate the airplane must not inhibit the primary display of flight or powerplant parameters needed by any flightcrew member in any normal mode of operation.","1"
"An automatic power or thrust control system intended for in - flight use must be designed so no unsafe condition will result during normal operation of the system.","0"
"The airplane must maintain longitudinal trim without further force upon, or movement of, the primary flight controls or corresponding trim controls by the pilot, or the flight control system during approach.","1"
"Each cockpit voice recorder must be installed so that it receives its electrical power from the bus that provides the maximum reliability for operation of the cockpit voice recorder without jeopardizing service to essential or emergency loads.","0"
"The airplane design must protect occupants from serious injury due to damage to windshields, windows, and canopies.","1"
"The control surfaces must be designed for the limit loads resulting from the flight conditions in Sections 25 - 331, 25 - 341 ( a ) and ( b ), 25 - 349, and 25 - 351, considering the requirements for trim tab effects, in Section 25 - 407.","0"
"The turbine engine air inlet system may not, as a result of air flow distortion during normal operation, cause vibration harmful to the engine.","1"
"The airplane must be designed so that it is controllable if all engines fail.","2"
"Longitudinal, lateral, directional, and drag control system and their supporting structures must be designed for loads corresponding to 125 percent of the computed hinge moments of the movable control surface in the conditions prescribed in Section 25 - 391.","0"
"The seat and restraint system in the airplane must be designed to protect each occupant during an emergency landing condition when proper use is made of seats, safety belts, and shoulder harnesses provided for in the design.","0"
"Each component, line, fitting, and control subject to fire conditions must be fire resistant if carrying flammable fluids, gas, or air or required to operate in event of a fire.","1"
"The airplane must have controllable stall characteristics in straight flight, turning flight, and accelerated turning flight.","2"
"Each flight recorder must be installed so that it is in a separate container from the cockpit voice recorder when both are required.","0"
"The control system must be designed for pilot forces applied in the same direction, using individual pilot forces not less than 0. 75 times those obtained under Section 25 - 395.","0"
"The airplane must be controllable and maneuverable, without requiring exceptional piloting skill, alertness, or strength, within the operating envelope during configuration changes.","1"
"For airplanes that have a system that actuates the landing gear there must be an alternative means available to bring the landing gear in the landing position when a non - deployed system position would be a hazard.","0"
"Vibration and buffeting, for operations up to V _ D / M _ D, must not interfere with the control of the airplane or cause excessive fatigue to the flightcrew.","2"
"At each point along the takeoff path, starting at the point at which the airplane reaches 400 feet above the takeoff surface, the available gradient of climb may not be less than 1. 5 percent for three - engine airplanes.","2"
"With the cabin configured for takeoff or landing, the airplane must have means of egress, that can be readily located and opened from the inside and outside.","1"
"The airplane must be able to complete a landing without causing substantial damage or serious injury using the steepest approved approach gradient procedures and providing a reasonable margin below V _ ref or above approach angle of attack.","2"
"For level 4 airplanes, each windshield and its supporting structure directly in front of the pilot must withstand, without penetration, the impact equivalent to a two - pound bird when the velocity of the airplane is equal to the airplane's maximum approach flap speed.","2"
"If an adjustable stabilizer is used, it must have stops that will limit its range of travel to the maximum for which the airplane is shown to meet the trim requirements of Section 25 - 161.","0"
"Trim tabs must be designed to withstand loads arising from all likely combinations of tab setting, primary control position, and airplane speed ( obtainable without exceeding the flight load conditions prescribed for the airplane as a whole ), when the effect of the tab is opposed by pilot effort forces up to those specified in Section 25 - 397 ( b ).","0"
"Hinges must have enough strength and rigidity for loads parallel to the hinge line.","0"
"Augmentation system drains must be designed and located in accordance with Section 25 - 1455 if the augmentation system fluid is subject to freezing.","0"
"Combustion heater installations must be protected from uncontained fire.","0"
"The airplane, even when damaged in an emergency landing, must protect each occupant against injury that would preclude egress when items of mass, including engines or auxiliary power units ( APUs ), within or aft of the cabin, that could injure an occupant, experience ultimate static inertia loads likely to occur in an emergency landing.","1"
"Each pilot compartment and its equipment must allow the minimum flight crew ( established under Section 25 - 1523 ) to perform their duties without unreasonable concentration or fatigue.","0"
"For levels 1, 2, and 3 airplanes, materials in the baggage and cargo compartments inaccessible in flight must be self - extinguishing.","1"
"For turbojet reversing systems, each system must have means to prevent the engine from producing more than idle thrust when the reversing system malfunctions, except that it may produce any greater forward thrust that is shown to allow directional control to be maintained, with aerodynamic means alone, under the most critical reversing condition expected in operation.","1"
"Each fuel storage refilling or recharging system must be designed to prevent improper refilling or recharging.","0"
"The airplane must be controllable and maneuverable, without requiring exceptional piloting skill, alertness, or strength, within the operating envelope at all loading conditions for which certification is requested.","1"
"Pressurized airplanes must be capable of continued safe flight and landing following a sudden release of cabin pressure, including sudden releases caused by door and window failures.","1"
"Each cockpit voice recorder shall record datalink messages as the output signal from the communications unit that translates the signal into usable data.","1"
"Any single failure or likely combination of failures of an automatic power or thrust control system must not prevent continued safe flight and landing of the airplane.","0"
"Each recorder container must have an underwater locating device, when required by the operating rules of this chapter, on or adjacent to the container, which is secured in such a manner that they are not likely to be separated during crash impact.","0"
"Control knobs must be shaped in accordance with Section 25 - 781.","0"
"The airplane must be free from flutter, control reversal, and divergence accounting for critical degrees of freedom.","2"
"Each cockpit voice recorder shall record voice communications of flightcrew members on the flight deck.","1"
"The steady gradient of climb may not be less than 2. 1 percent for two - engine airplanes, 2. 4 percent for three - engine airplanes, and 2. 7 percent for four - engine airplanes, with a climb speed established in connection with normal landing procedures, but not exceeding 1. 4 V _ SR.","2"
"The landing gear control must be located forward of the throttles and must be operable by each pilot when seated with seat belt and shoulder harness ( if provided ) fastened.","0"
"Each removable bolt, screw, nut, pin, or other removable fastener must incorporate two separate locking devices if its loss could result in reduction in pitch, yaw, or roll control capability or response below that required by Subpart B of this chapter.","0"
"The power generation, storage, and distribution for any system must be designed and installed to have enough capacity, if the primary source fails, to supply essential loads, including non - continuous essential loads for the time needed to complete the function required for continued safe flight and landing.","0"
"Servo tabs must be designed for deflections consistent with the primary control surface loading conditions obtainable within the pilot maneuvering effort, considering possible opposition from the trim tabs.","0"
"The propeller speed and pitch must be limited to values that will ensure safe operation under normal operating conditions.","0"
"Movable tail surfaces must be installed so that there is no interference between any surfaces when one is held in its extreme position and the others are operated through their full angular movement.","0"
"The system and equipment design must minimize flightcrew errors, which could result in additional hazards.","1"
"The pilot compartment must be constructed so that, when flying in rain or snow, it will not leak in a manner that will distract the crew or harm the structure.","0"
"A means to ensure the prompt detection of fire must be provided for each designated fire zone on a multiengine airplane where detection will mitigate likely hazards to the airplane.","1"
"Each fuel system for a turbine engine must be capable of sustained operation throughout its flow and pressure range with fuel initially saturated with water at 80 F and having 0. 75cc of free water per gallon added and cooled to the most critical condition for icing likely to be encountered in operation.","2"
"Each removable bolt, screw, nut, pin, or other removable fastener must incorporate two separate locking devices if its loss could preclude continued flight and landing within the design limitations of the airplane using normal pilot skill and strength.","0"
"Each fuel storage system must be designed to prevent significant loss of stored fuel from any vent system due to fuel transfer between fuel storage or supply systems, or under likely operating conditions.","0"
"Each recorder container must have an underwater locating device, when required by the operating rules of this chapter, on or adjacent to the container, which is secured in such manner that they are not likely to be separated during crash impact.","1"
"For level 4, the airplane must maintain lateral and directional trim during normal operations without further force upon, or movement of, the primary flight controls or corresponding trim controls by the pilot, or the flight control system.","1"
"Each fuel system must be arranged so that any air which is introduced into the system will not result in power interruption for more than 20 seconds for reciprocating engines.","2"
"Each part of the airplane near the propeller tips must be strong and stiff enough to withstand the effects of the induced vibration and of ice thrown from the propeller.","0"
"Inadvertent operation of an automatic power or thrust control system by the flightcrew must be prevented, or if not prevented, must not result in an unsafe condition.","0"
"The airplane must maintain longitudinal, directional, and lateral trim ( and for the lateral trim, the angle of bank may not exceed five degrees ) at 1. 3 V _ SR1 during climbing flight with the landing gear and flaps retracted.","2"
"The airplane must maintain longitudinal trim without further force upon, or movement of, the primary flight controls or corresponding trim controls by the pilot, or the flight control system during descent.","1"
"Airplanes certified for aerobatics that include spins must have controllable stall characteristics and the ability to recover within one and one - half additional turns after initiation of the first control action from any point in a spin, not exceeding six turns or any greater number of turns for which certification is requested, while remaining within the operating limitations of the airplane.","2"
"Each tire installed on a retractable landing gear system must, at the maximum size of the tire type expected in service, have a clearance to surrounding structure and systems that is adequate to prevent unintended contact between the tire and any part of the structure or systems.","0"
"Each baggage and cargo compartment must have a means to prevent the contents of the compartment from becoming a hazard by impacting occupants or shifting.","1"
"In designated fire zones, terminals, equipment, and electrical cables used during emergency procedures must be fire - resistant.","1"
"The steady gradient of climb may not be less than 2. 1 percent for two - engine airplanes, 2. 4 percent for three - engine airplanes, and 2. 7 percent for four - engine airplanes, with landing gear retracted.","2"
"Seaplanes must be designed for the water loads developed during takeoff and landing, with the seaplane in any attitude likely to occur in normal operation.","0"
"Pressurized airplanes with maximum operating altitude greater than 41000 feet, must be capable of detecting damage to the pressurized cabin structure before the damage could result in rapid decompression that would result in serious or fatal injuries.","1"
"Each fuel storage system must withstand the loads under likely operating conditions without failure.","2"
"The airplane must maintain longitudinal trim without further force upon, or movement of, the primary flight controls or corresponding trim controls by the pilot, or the flight control system during climb.","1"
"Each element of each flight control system must be designed, or distinctively and permanently marked, to minimize the probability of incorrect assembly that could result in the malfunctioning of the system.","0"
"The landing gear must provide stable support and control to the airplane during surface operation.","1"
"Each tank must be able to withstand without failure the vibration, inertia, fluid, and structural loads that it may be subject to in operation.","2"
"The control surfaces must be designed for the limit loads resulting from the flight conditions in Sections 25 - 331, 25 - 341 ( a ) and ( b ), 25 - 349, and 25 - 351, considering the requirements for loads parallel to hinge line, in Section 25 - 393.","0"
"The airplane must be designed for a maneuvering load factor of 1. 5 g at the maximum take - off weight with the wing - flaps and similar high lift devices in the landing configurations.","0"
"Each cockpit voice recorder must be installed so that any single electrical failure external to the recorder does not disable both the cockpit voice recorder and the flight data recorder.","0"
"The airplane must be safely controllable and maneuverable during takeoff.","2"
"The tanks as mounted in the airplane must be able to withstand without failure or leakage an internal pressure 1. 5 times the maximum operating pressure.","2"
"The flightcrew interface design must allow for continued safe flight and landing after the loss of vision through any one of the windshield panels.","1"
"Unless the failure of an automatic power or thrust control system is extremely remote, the system must provide a means for the flightcrew to override the automatic function.","1"
"The airplane must maintain longitudinal, directional, and lateral trim ( and for the lateral trim, the angle of bank may not exceed five degrees ) at 1. 3 V _ SR1 during climbing flight with the remaining engines at maximum continuous power.","2"
"Levels 1 and 2 multiengine airplanes, not certified for aerobatics, must not have a tendency to inadvertently depart controlled flight from thrust asymmetry after a critical loss of thrust.","2"
"Each control system must have stops that positively limit the range of motion of each movable aerodynamic surface controlled by the system.","2"
"Each fuel storage system must be capable of jettisoning fuel safely if required for landing.","1"
"The structure supporting any engine or auxiliary power unit must be designed for the loads, including gyroscopic loads, arising from the conditions specified in Sections 25 - 331, 25 - 341, 25 - 349, 25 - 351, 25 - 473, 25 - 479, and 25 - 481, with the engine or auxiliary power unit at the maximum rotating speed appropriate to the condition.","0"
"The flight control systems and surfaces must be designed for the limit loads generated when the airplane is subjected to a horizontal 65 - knot ground gust from any direction while taxiing and while parked.","0"
"Pressurization system must be designed to protect against decompression to an unsafe level.","0"
"The airplane design must protect the pilot and flight controls from propellers.","1"
"Each flight recorder must be installed so that there is an aural or visual means for preflight checking of the recorder for proper recording of data in the storage medium.","0"
"Any taxi and landing lights must be designed and installed so they provide sufficient light for night operations.","0"
"The design must clearly indicate the function of each cockpit control, other than primary flight controls.","0"
"The brake controls must be designed and constructed so that excessive control force is not required for their operation.","0"
"For levels 1, 2 and 3 airplanes, materials in each compartment accessible in flight must be flame resistant.","1"
"Each part of the airplane must have adequate provisions for ventilation and drainage.","0"
"Each cockpit voice recorder must be installed so that it has an independent power source to which the cockpit voice recorder and cockpit - mounted area microphone are switched automatically in the event that all other power to the cockpit voice recorder is interrupted either by normal shutdown or by any other loss of power to the electrical power bus.","1"
"Trim systems must provide a means to indicate the range for takeoff for all applicant requested center of gravity ranges and configurations.","1"
"The airplane flight control systems must be designed to protect against likely hazards.","0"
"Trim systems must provide a means to indicate the direction of trim control movement relative to airplane motion.","1"
"Each main float must have a buoyancy of 80 percent in excess of that required to support the maximum weight of the seaplane or amphibian in fresh water.","0"
"Pressurization system must be designed to protect against excessive differential pressure.","0"
"For level 4 airplanes, each baggage and cargo compartment must be located where a fire would be visible to the pilots, or equipped with a fire detection system and warning system.","0"
"All lights must be designed and installed to minimize any adverse effects on the performance of flightcrew duties.","0"
"Airplanes approved for aerobatics must have a means to egress the airplane in flight.","1"
"Each baggage and cargo compartment must be designed for its maximum weight of contents and for the critical load distributions at the maximum load factors corresponding to the flight and ground load conditions determined under this part.","0"
"The powerplant installation design must prevent any accumulation of ice or snow that adversely affects powerplant operation, in those icing conditions for which certification is requested.","1"
"The structure must support limit loads without detrimental permanent deformation.","1"
"Each fuel storage system must provide fuel for at least one - half hour of operation at maximum continuous power or thrust.","2"
"Airplanes not certified for aerobatics must have static longitudinal, lateral, and directional stability in normal operations.","2"
"The aircraft shall supply airspeed data to the flight recorder.","1"
"The record container must be located as far aft as practicable, but need not be aft of the pressurized compartment, and may not be where aft - mounted engines may crush the container upon impact.","0"
"A means to ensure the prompt detection of fire must be provided for each designated fire zone that contains a fire extinguisher.","1"
"For airplanes intended for operation on land or water, the airplane must have controllable longitudinal and directional handling characteristics during taxi, takeoff, and landing operations.","2"
"Each fuel system must provide at least 100 percent of the fuel flow required under each intended operating condition and maneuver.","2"
"The air induction system for each powerplant or auxiliary power unit and their accessories must provide an alternate intake if blockage of the primary intake is likely.","0"
"Control surfaces and supporting hinge brackets must be designed for inertia loads acting parallel to the hinge line.","0"
"A means to extinguish fire within a fire zone, except a combustion heater fire zone, must be provided for any fire zone on a level 4 airplane.","1"
"The airplane flight control systems must be designed to operate easily, smoothly, and positively enough to allow proper performance of their functions.","0"
"Any position and anti - collision lights must have the flash rate to provide sufficient time for another aircraft to avoid a collision.","0"
"The aircraft shall supply altitude data to the flight recorder.","1"
"The structure must support limit loads without interference with the safe operation of the airplane.","1"
"The landing gear system must be designed so that when it fails due to overloads during takeoff and landing, the failure mode is not likely to cause spillage of enough fuel to constitute a fire hazard.","0"
"For turbojet reversing systems, each system intended for ground operation only must be designed so that during any reversal in flight the engine will produce no more than flight idle thrust.","0"
